{
  "id": "11111111-1111-4111-8111-111111111111",
  "status": "confirmed",
  "revision": 2,
  "created_at": "2026-10-24T12:00:00Z",
  "updated_at": "2026-10-24T12:02:00Z",
  "messages": [
    {
      "id": "22222222-2222-4222-8222-222222222222",
      "role": "assistant",
      "text": "What starts this process, and which department is responsible?",
      "created_at": "2026-10-24T12:00:00Z"
    },
    {
      "id": "33333333-3333-4333-8333-333333333333",
      "role": "employee",
      "text": "The Economic Development department handles business permit applications. A licensing officer is the process owner. It starts when a business submits an application and an address document. The licensing officer checks the documents, then a supervisor approves or rejects the permit. The goal is to authorize local business activity, and the output is an approved permit or a rejection notice.",
      "created_at": "2026-10-24T12:01:00Z"
    },
    {
      "id": "44444444-4444-4444-8444-444444444444",
      "role": "assistant",
      "text": "I captured the permit process. Please review the draft. You can also add any business rules, exceptions, or system integration needs before confirming.",
      "created_at": "2026-10-24T12:01:05Z"
    }
  ],
  "form": {
    "municipality": "Example City",
    "process_name": "Small business permit",
    "objective": "Authorize local business activity",
    "department": "Economic Development",
    "owner_role": "Licensing officer",
    "trigger": "A business submits an application",
    "inputs": [
      "Application",
      "Address document"
    ],
    "steps": [
      {
        "description": "Check the submitted documents",
        "responsible_role": "Licensing officer"
      },
      {
        "description": "Approve or reject the permit",
        "responsible_role": "Supervisor"
      }
    ],
    "business_rules": [],
    "exceptions": [],
    "current_systems": [],
    "integration_needs": [],
    "expected_output": "Approved permit or rejection notice"
  },
  "missing_fields": [],
  "confirmed_snapshot": {
    "form": {
      "municipality": "Example City",
      "process_name": "Small business permit",
      "objective": "Authorize local business activity",
      "department": "Economic Development",
      "owner_role": "Licensing officer",
      "trigger": "A business submits an application",
      "inputs": [
        "Application",
        "Address document"
      ],
      "steps": [
        {
          "description": "Check the submitted documents",
          "responsible_role": "Licensing officer"
        },
        {
          "description": "Approve or reject the permit",
          "responsible_role": "Supervisor"
        }
      ],
      "business_rules": [],
      "exceptions": [],
      "current_systems": [],
      "integration_needs": [],
      "expected_output": "Approved permit or rejection notice"
    },
    "confirmed_at": "2026-10-24T12:02:00Z",
    "revision": 2
  }
}
