{
  "id": "11111111-1111-4111-8111-111111111111",
  "status": "draft",
  "revision": 0,
  "created_at": "2026-10-24T12:00:00Z",
  "updated_at": "2026-10-24T12:00:00Z",
  "messages": [
    {
      "id": "22222222-2222-4222-8222-222222222222",
      "role": "assistant",
      "text": "What starts this process, and which department is responsible?",
      "created_at": "2026-10-24T12:00:00Z"
    }
  ],
  "form": {
    "municipality": "Example City",
    "process_name": "Small business permit",
    "objective": null,
    "department": null,
    "owner_role": null,
    "trigger": null,
    "inputs": [],
    "steps": [],
    "business_rules": [],
    "exceptions": [],
    "current_systems": [],
    "integration_needs": [],
    "expected_output": null
  },
  "missing_fields": [
    "department",
    "expected_output",
    "objective",
    "owner_role",
    "steps",
    "trigger"
  ],
  "confirmed_snapshot": null
}
